{
  "domain": "www.foundrole.com",
  "name": "FoundRole",
  "manifest_url": "https://www.foundrole.com/.well-known/ojcp.json",
  "trust_tier": "unverified",
  "manifest_signed": false,
  "has_agent_apply": false,
  "attestations": [],
  "added_at": "2026-10-13",
  "tier_history": [
    { "tier": "unverified", "date": "2026-10-13", "note": "Initial listing. Read-only provider (search_jobs, get_job_detail); passes the conformance suite 9/9." }
  ]
}
